{
  "schema_version": 1,
  "updated": "2026-10-17",
  "fetched": "2026-10-17",
  "playlists": {
    "PLS3E2qEMmF3g": {
      "title": "Desk Lessons",
      "video_ids": [
        "uCDpkEJ9Pdg",
        "rKTadKQ4CYU",
        "8BbY-FJLGt0",
        "DPXmsLBjyyw",
        "8kPsv_p2SiI",
        "rkLKEh6iJnE",
        "I5SlmowU-m8",
        "foexgrUcbXI",
        "xnVng9WfKok"
      ]
    },
    "PLBKFd3n5MZjU": {
      "title": "Desk Automation",
      "video_ids": [
        "ePnW2xZwtEs",
        "2Xm-n0K7pIM",
        "SHOUFDOB8gM",
        "9W9pWYEzjmM"
      ]
    },
    "PLUy9tBSEDTLo": {
      "title": "Desk Notes",
      "video_ids": [
        "lWOBtSHlntM",
        "hZ8WbNMAzwc",
        "VLUIIDaZA_c"
      ]
    },
    "PLO8b2qzU_eTM": {
      "title": "Everyone Asks AI",
      "video_ids": [
        "-pBNgF-zPgU",
        "Aozxob3tH6w"
      ]
    },
    "PLv9w9kEp4uj-nmoe9uzRfFmaEywqgFvaP": {
      "title": "Desk News",
      "video_ids": [
        "ppuPa2kSOdk",
        "v8ZJFXf6Fvo",
        "9eNMhvKqRa4"
      ]
    },
    "PLv9w9kEp4uj9FVKvBECrrFqcjEAlCskWi": {
      "title": "Desk Loops",
      "video_ids": [
        "YxLERCHY8Yc",
        "eZXUIn9GZTI"
      ]
    }
  },
  "reach": {
    "report_type": "channel_reach_basic_a1",
    "job_id": null,
    "job_created": null,
    "ingested": [],
    "status": "api disabled"
  },
  "videos": {
    "lWOBtSHlntM": {
      "title": "Before You Run an AI Agent, You need to Write the Stop Line",
      "published_at": "2026-10-17",
      "duration_seconds": 60,
      "privacy": "public",
      "content_type": null,
      "content_key": "025-always-on-agents/short",
      "key_source": "manual",
      "metrics": {
        "fetched": "2026-10-17"
      }
    },
    "hZ8WbNMAzwc": {
      "title": "This is how my AI Agent Sent 73 Emails Nobody Approved",
      "published_at": "2026-10-17",
      "duration_seconds": 207,
      "privacy": "public",
      "content_type": "long",
      "content_key": "025-always-on-agents",
      "key_source": "title",
      "metrics": {
        "fetched": "2026-10-17"
      }
    },
    "uCDpkEJ9Pdg": {
      "title": "Does AI Learn From You? I Corrected an AI 100 Times and nothing happened",
      "published_at": "2026-10-09",
      "duration_seconds": 59,
      "privacy": "public",
      "content_type": "short",
      "content_key": "024-frozen/short",
      "key_source": "title",
      "metrics": {
        "fetched": "2026-10-17",
        "views": 228,
        "watch_minutes": 44,
        "avg_view_seconds": 27,
        "retention_pct": 47.35,
        "subs_gained": 1,
        "traffic": {
          "NO_LINK_OTHER": 0,
          "YT_SEARCH": 1,
          "YT_OTHER_PAGE": 3,
          "NOTIFICATION": 2,
          "SHORTS": 222
        }
      }
    },
    "rKTadKQ4CYU": {
      "title": "“You're Absolutely Right!” — Why AI Never Learns From You",
      "published_at": "2026-10-09",
      "duration_seconds": 132,
      "privacy": "public",
      "content_type": "long",
      "content_key": "024-frozen",
      "key_source": "title",
      "metrics": {
        "fetched": "2026-10-17",
        "views": 12,
        "watch_minutes": 2,
        "avg_view_seconds": 127,
        "retention_pct": 96.64,
        "subs_gained": 0,
        "traffic": {
          "NO_LINK_OTHER": 0,
          "SUBSCRIBER": 10,
          "YT_SEARCH": 1,
          "NOTIFICATION": 1
        }
      }
    },
    "8BbY-FJLGt0": {
      "title": "53% of an AI's Attention Goes to a Meaningless Word #shorts #ai",
      "published_at": "2026-08-25",
      "duration_seconds": 57,
      "privacy": "public",
      "content_type": "short",
      "content_key": "023-attention/short",
      "key_source": "title",
      "metrics": {
        "fetched": "2026-10-17",
        "views": 9,
        "watch_minutes": 4,
        "avg_view_seconds": 53,
        "retention_pct": 93.92,
        "subs_gained": 0,
        "traffic": {
          "NO_LINK_OTHER": 0,
          "SUBSCRIBER": 3,
          "YT_SEARCH": 3,
          "SHORTS": 3
        }
      }
    },
    "DPXmsLBjyyw": {
      "title": "Attention! It Doesn't Focus. It Spends",
      "published_at": "2026-08-25",
      "duration_seconds": 378,
      "privacy": "public",
      "content_type": "long",
      "content_key": "023-attention",
      "key_source": "title",
      "metrics": {
        "fetched": "2026-10-17",
        "views": 17,
        "watch_minutes": 6,
        "avg_view_seconds": 189,
        "retention_pct": 50.1,
        "subs_gained": 0,
        "traffic": {
          "NO_LINK_OTHER": 0,
          "SUBSCRIBER": 15,
          "YT_SEARCH": 1,
          "NOTIFICATION": 1
        }
      }
    },
    "8kPsv_p2SiI": {
      "title": "You've Never Had a Conversation With an AI",
      "published_at": "2026-08-18",
      "duration_seconds": 56,
      "privacy": "public",
      "content_type": "short",
      "content_key": "022-context-window/short",
      "key_source": "title",
      "metrics": {
        "fetched": "2026-10-17",
        "views": 313,
        "watch_minutes": 15,
        "avg_view_seconds": 17,
        "retention_pct": 30.61,
        "subs_gained": 0,
        "traffic": {
          "NO_LINK_OTHER": 0,
          "SUBSCRIBER": 2,
          "YT_CHANNEL": 1,
          "YT_SEARCH": 6,
          "YT_OTHER_PAGE": 14,
          "SHORTS": 290
        }
      }
    },
    "rkLKEh6iJnE": {
      "title": "The Context Window Is Not Memory. It Re-Reads Everything.",
      "published_at": "2026-08-18",
      "duration_seconds": 376,
      "privacy": "public",
      "content_type": "long",
      "content_key": "022-context-window",
      "key_source": "title",
      "metrics": {
        "fetched": "2026-10-17",
        "views": 2,
        "watch_minutes": 6,
        "avg_view_seconds": 375,
        "retention_pct": 99.87,
        "subs_gained": 0,
        "traffic": {
          "NO_LINK_OTHER": 0,
          "SUBSCRIBER": 1,
          "YT_SEARCH": 1
        }
      }
    },
    "I5SlmowU-m8": {
      "title": "Your AI Never Reads Words. It Reads Chunks. #shorts #ai #automation #token #lessons #learning #chunk",
      "published_at": "2026-08-16",
      "duration_seconds": 53,
      "privacy": "public",
      "content_type": "short",
      "content_key": "021-what-is-a-token/short",
      "key_source": "manual",
      "metrics": {
        "fetched": "2026-10-17",
        "views": 56,
        "watch_minutes": 8,
        "avg_view_seconds": 28,
        "retention_pct": 54.620000000000005,
        "subs_gained": 0,
        "traffic": {
          "NO_LINK_OTHER": 0,
          "YT_CHANNEL": 1,
          "YT_SEARCH": 1,
          "YT_OTHER_PAGE": 5,
          "NOTIFICATION": 4,
          "SHORTS": 45
        }
      }
    },
    "foexgrUcbXI": {
      "title": "What Is a Token? The 3 Things It Silently Decides",
      "published_at": "2026-08-16",
      "duration_seconds": 281,
      "privacy": "public",
      "content_type": "long",
      "content_key": "021-what-is-a-token",
      "key_source": "title",
      "metrics": {
        "fetched": "2026-10-17",
        "views": 9,
        "watch_minutes": 8,
        "avg_view_seconds": 73,
        "retention_pct": 26.239999999999995,
        "subs_gained": 0,
        "traffic": {
          "NO_LINK_OTHER": 0,
          "SUBSCRIBER": 5,
          "YT_SEARCH": 2,
          "RELATED_VIDEO": 2
        }
      }
    },
    "xnVng9WfKok": {
      "title": "Why Does ChatGPT Sound So Confident When It's Wrong? #shorts #ai #chatgpt #llm #aimodel #token",
      "published_at": "2026-07-22",
      "duration_seconds": 57,
      "privacy": "public",
      "content_type": "short",
      "content_key": "019-next-word-engine/short",
      "key_source": "title",
      "metrics": {
        "fetched": "2026-10-17",
        "views": 31,
        "watch_minutes": 4,
        "avg_view_seconds": 35,
        "retention_pct": 61.44,
        "subs_gained": 0,
        "traffic": {
          "NO_LINK_OTHER": 0,
          "SUBSCRIBER": 2,
          "YT_CHANNEL": 1,
          "YT_SEARCH": 1,
          "SHORTS": 27
        }
      }
    },
    "ui7KaKzZso4": {
      "title": "20 Years. One Page. — The Story Behind The Automation Desk",
      "published_at": "2026-07-19",
      "duration_seconds": 100,
      "privacy": "public",
      "content_type": "long",
      "content_key": "018-life-story",
      "key_source": "title",
      "metrics": {
        "fetched": "2026-10-17",
        "views": 11,
        "watch_minutes": 9,
        "avg_view_seconds": 58,
        "retention_pct": 58.57,
        "subs_gained": 0,
        "traffic": {
          "NO_LINK_OTHER": 0,
          "SUBSCRIBER": 4,
          "YT_CHANNEL": 2,
          "YT_SEARCH": 2,
          "YT_OTHER_PAGE": 2,
          "END_SCREEN": 1
        }
      }
    },
    "qglzqGydJV4": {
      "title": "I Built an AI Agent That Knows Which Changes Matter #shorts #ai #claude #chatgpt #automation #agent",
      "published_at": "2026-07-15",
      "duration_seconds": 94,
      "privacy": "public",
      "content_type": "short",
      "content_key": "017-fine-print-watch",
      "key_source": "manual",
      "metrics": {
        "fetched": "2026-10-17",
        "views": 95,
        "watch_minutes": 20,
        "avg_view_seconds": 33,
        "retention_pct": 35.85,
        "subs_gained": 0,
        "traffic": {
          "NO_LINK_OTHER": 0,
          "SUBSCRIBER": 4,
          "YT_CHANNEL": 2,
          "YT_SEARCH": 1,
          "YT_OTHER_PAGE": 6,
          "EXT_URL": 1,
          "SHORTS": 81
        }
      }
    },
    "ePnW2xZwtEs": {
      "title": "Will AI Take Your Job? I Gave It the Worst Hour #ai #shorts #automation #job #bussiness",
      "published_at": "2026-07-13",
      "duration_seconds": 61,
      "privacy": "public",
      "content_type": "short",
      "content_key": "014-worst-hour",
      "key_source": "title",
      "metrics": {
        "fetched": "2026-10-17",
        "views": 36,
        "watch_minutes": 9,